Τίτλος του δίσκου;Τίτλος τραγουδιού;Συνθέτης;Στιχουργός;Τραγουδιστής;ΕΤΑΙΡΕΙΑ;Ετος κυκλοφ.;Στίχοι;Εκτέλεση;Χρόνος
Ο Ελληνας της ξενιτιάς;Στη Νέα Βαβυλώνα;Γιαννόπουλος Χρήστος;Ιερομνήμων Κώστας;Γιαννόπουλος Χρήστος;ΚΑΘΡΕΦΤΗΣ ΗΧΩΝ ΑΛΗΘΙΝΩΝ ( EL );2018-01-01;"Λούστρος στην πέμπτη λεωφόρο,
πιατάς δουλεύεις στην Αστόρια
δεν είχε η Ελλάδα βλέπεις χώρο,
όταν πλακώσανε τα ζόρια.

Δουλειά δε δίνει το πτυχίο,
πώς να την ζήσεις τη φαμίλια
μήπως σου κάτσει το λαχείο,
έφυγες για χιλιάδες μίλια.

Ξυπνάς στην νέα Βαβυλώνα,
κοιμάσαι σ' άβυσσο πικρή
πώς να μιλάς για Παρθενώνα,
στην κάμαρα σου τη μικρή.

Πάντα στημένος στην γωνία
κουράγιο ψάχνεις να σταθείς,
και ζεις εκεί στην αγωνία
και στο μαράζι μην χαθείς.

Κι αν κάποτε σε βρει η τύχη
κι αλλάξει κάτι στην ζωή σου,
ακόμα κι αν θαχεις πετύχει,
λούστρο θα κουβαλάει πάντα η ψυχή σου.";1;2018
Από το παράθυρο;Ο Ελληνας της ξενιτειάς;Γιαννόπουλος Χρήστος;Ιερομνήμων Κώστας;Καρελάς Λάμπρος;NEXT RECORDS;2013-01-01;"Ο Έλληνας της ξενιτειάς σαν πυροσβέστης μιας φωτιάς που μέσα του τον καίει.
Παλεύει φλόγες και καπνούς, μα στην πατρίδα του ο νους είναι και κρυφοκλαίει.
Κι όταν ακόμα αυτός γλεντά δάκρυ στα μάτια τρέχει,
γιατί τον τόπο του κοντά θέλει μα δεν τον έχει.
Κι όταν το ρίχνει στο πιοτό με όνειρα ταξιδεύει,
και σε σεργιάνι νοερό τον χρόνο του ξοδεύει.

Ο Έλληνας που νοσταλγεί όπου κι αν βρίσκεται στη γη μες στην καρδιά του δάδα,
κρύβει βαθειά και προσπαθεί να μη του σβήσει και χαθεί η σπίθα για Ελλάδα.
Κι όταν το ρίχνει στο χορό ξέρω ανάγκη έχει,
να τιθασεύσει τον καιρό στην ξενιτειά ν' αντέχει.
Κι όταν τη σκέψη του μεθά ψάχνει για να ξεφύγει,
αφού η ελπίδα με τα θα... δρόμους για πίσω ανοίγει.";1;2013
Μου χρωστάς μια αγάπη ουρανέ;Θέλω να γράψω ένα τραγούδι;Λυκούδη Πηγή;Ιωαννίδης Ιωάννης Π.;Χατζηκωττάκη Αγνή;ΚΑΘΡΕΦΤΗΣ ΗΧΩΝ ΑΛΗΘΙΝΩΝ ( EL );2007-01-01;"Θέλω να γράψω ένα τραγούδι,
να 'χει αρμύρα και φιλί,
θέλω να γράψω ένα τραγούδι,
να 'χει θαλασσινή γιορτή.

Είναι τα μάτια σου κοράλια,
είναι τα μάτια σου φιλιά,
του μακρινού ανέμου, χάδι
στου έρωτα την αγκαλιά.

Θέλω να γράψω ένα τραγούδι,
να 'χει αρμύρα και φιλί,
θέλω να γράψω ένα τραγούδι,
να 'χει του έρωτα ψυχή.

Είναι τα μάτια σου Ελλάδα,
είναι τα μάτια σου νησιά,
του γαλανού Αιγαίου, κύμα
και θαλασσόβρεχτη αγκαλιά.

Είναι τα μάτια σου κοράλια,
είναι τα μάτια σου φιλιά,
του μακρινού ανέμου, χάδι
στου έρωτα την αγκαλιά.

Είναι τα μάτια σου Ελλάδα,
είναι τα μάτια σου νησιά,
του γαλανού Αιγαίου, κύμα
και θαλασσόβρεχτη αγκαλιά.

Είναι τα μάτια σου κοράλια,
είναι τα μάτια σου φιλιά,
του μακρινού ανέμου, χάδι,
στου έρωτα την αγκαλιά.

Θέλω να γράψω ένα τραγούδι,
να 'χει του έρωτα ψυχή.";1;2007
Μου χρωστάς μια αγάπη ουρανέ;Ιωνία εσύ πατρίδα;Λυκούδη Πηγή;Ιωαννίδης Ιωάννης Π.;Χατζηκωττάκη Αγνή;ΚΑΘΡΕΦΤΗΣ ΗΧΩΝ ΑΛΗΘΙΝΩΝ ( EL );2007-01-01;"Ιωνία εσύ πατρίδα
άστρο άδυτο, χρυσό
Ιωνία εσύ, πατρίδα
φως σκορπάς αυγερινό.

Ιωνία εσύ πατρίδα
των αγγέλων ο λυγμός
Ιωνία εσύ πατρίδα
της Ανατολής το φως

Κλαίνε τα βιολιά για σένα
Σμύρνη, Πόλη, Αϊβαλί
κλαίνε τα βιολιά για σένα
λατρεμένη Ανατολή

Κλαίνε τα βιολιά για σένα
Σμύρνη, Πόλη, Αϊβαλί
κλαίνε τα βιολιά για σένα
προδομένη Ανατολή

Είσαι ματωμένος ήλιος
είσαι μαύρος ουρανός
είσαι της γλυκιάς Ελλάδας
ο αγιάτρευτος καημός";1;2007
;Καφάρ;Κατσικάς Νίκος;Καββαδίας Νίκος;Χατζηαντωνίου Γιώργος;;1984-09-01;"Να ζεις στην ίδια πολιτεία παντοτινά
και να 'χεις των αναχωρήσεων τη μανία ,
μα φεύγοντας απ' το γραφείο τα βραδινά
να κάνεις οφθαλμοπορνεία στα καφενεία .

Αλλοτες είχαμε τα πλοία κρυφό σκοπό , 
μα ο κόσμος έγινε σαν αδειανή φυλλάδα , 
είναι το ίδιο πιά να μένεις στην Ελλάδα
με το να ταξιδεύεις στο Fernando Po .

Τα φορτηγά είναι κακοτάξιδα κι αργούν , 
μες στα ποστάλια πλήττεις βλέποντας τουρίστες , 
το να φορτώνεις μήνες ρύζια στο Ραγκούν
είν' ένα πράγμα που σκοτώνει τους αρτίστες .

Οι πόλοι γίνανε σε μας πολύ γνωστοί , 
θαυμάσαμε πολλές φορές το Βόρειο Σέλας
κι έχουν οι πάγοι χρόνια τώρα σκεπαστεί
από αδειανά κουτιά σπανιόλικης σαρδέλλας .

Στην Ταϊτή έζησε μήνες κι ο Λοτί , 
αν πας λιγάκι παρακάτου , στις Μαρκίζες , 
που άλλοτες τρώγανε μπανάνες κι άγριες ρίζες , 
καλλυντικά τώρα πουλάνε του Coty .

Οι Γιαπωνέζες , τα κορίτσια στη Χιλή , 
κι οι μαύρες του Μαρόκου που πουλάνε μέλι , 
έχουν σαν όλες τις γυναίκες τα ίδια σκέλη
και δίνουν με τον ίδιο τρόπο το φιλί .

Η αυτοκτονία , προνόμιο πιά στα θηλυκά 
κάποτε κάνναμε κι εμείς αυτή τη σκέψη .
Πεθαίνεις πιο σιγά με τα ναρκωτικά , 
μα τελευταία κι αυτά τάχουν νοθέψει .";1;1984
Χάραμα Καισαριανής;Ο γυιός του Ανδρέα;Τσιαντής Γιάννης;Κακλαμάνης Τάσος;Παπατραγιάννης Σωτήρης;ΜΕΤΡΟΝΟΜΟΣ ( EL );2023-02-01;"Παντζούρια και πορτόφυλλα κλειστά
η Αθήνα προ ερπυστριών θυσίας
λοξά κοιτά ο Μανούσος τον Πλυτά
στο Παρθενών καφέ της Κηφισίας

Ο Ανδρέας Γλεντζάκης κλαίει απ' τις εφτά
και τρίζουν οι Χανιώτικές του πλάτες
Σαράντα μια Απρίλη είκοσι εφτά
Δωσίλογοι, Ναζί μπήκαν πελάτες

R… Στα τεθωρακισμένα οι Γερμανοί
τινάζουνε τη σκόνη από τις μπότες
και μια δασκάλα στην Καισαριανή
στον τοίχο γράφει «Βόλι στους προδότες»

Μαρμάρινο τραπέζι με στυλό
Φον Σέφεν υπογράφει και Καβράκος
στο βλέμμα του Αντρέα το σιωπηλό
μια ολόκληρη Ελλάδα μέσα ράκος

Η Πηνελόπη Δέλτα αυτοκτονεί
Κατάρα λέει ο Χρύσανθος θα στείλω
Κουκίδης μ' ένα μπλε λευκό πανί
πηδάει απ' την Ακρόπολη στο θρύλο

R… Στα τεθωρακισμένα οι Γερμανοί…

Ο Ανδρέας το γιο του σφίγγει με απονιά
το μπράτσο του παιδιού έχει κοκκινήσει
του λέει είμαστε απ' την Ασή Γωνιά
ποτέ του στη ζωή μην προσκυνήσει

Απρίλη η ομάδα είχε συσταθεί
παιδιά θυμάμαι τότε είμασταν όλοι
που ο γυιός του Αντρέα το ξύλινο σπαθί
το άφησε και πήρε το πιστόλι";1;2023
Γιώργος Μαρίνος;Ελλάς Ελλήνων Χριστιανών;Κριμιζάκης Γιώργος;Κακουλίδης Γιάννης;Μαρίνος Γιώργος;MINOS ( EL );1980-12-01;"Παίρνετε μια ντουζίνα τανκς, ένα μυστρί και μία πλάκα
κι αφού ξορκίσετε τον Μαρξ θεμελιώνετε ατάκα.
Διαλέγετε ένα πτηνό ει δυνατόν με 2 κεφάλια
το στήνετε στον Υμηττό με τα φτερά του σαν βεντάλια.

Ελλάς ελλήνων Χριστιανών
άνευ βουλής και εκλογών
έτσι τα έθνη μόνο ζουν
ταρατατζούμ ταρατατζούμ ταρατατζούμ

Βάζετε για πρωθυπουργό της Σαντορίνης τον ωραίο
και δε πειράζει για μετά τ' αδίκημα είναι στιγμιαίο.
Συγκέντρωσις είναι εφικτή το μάξιμουμ ενός ατόμου
κι έτσι αποφεύγεται η ειρκτή και η εξάρθρωσις του ώμου.

Ελλάς ελλήνων Χριστιανών
άνευ βουλής και εκλογών κύριοι
έτσι τα έθνη μόνο ζουν
ταρατατζούμ ταρατατζούμ ταρατατζούμ

Συλλήψεις είναι αποδεκτές Τρίτη, Τετάρτη και Σαββάτο
αλλά μπορείτε κι από χθες για να τους έχετε από κάτω.
Πρόσφορη μέρα για όλα αυτά μία απ' τις τόσες του Απρίλη
αρχίζετε πρωί πρωί και τελειώνετε το δείλι.";1;1980
Τα χαμένα χρόνια;Η Παναγιά στα τζάμια;Πλέσσας Μίμης;Κακουλίδης Γιάννης;Ψαριανός Δημήτρης & Σαββίδη Βούλα;LYRA ( EL );1977-02-01;"Τα δίκοχα στον ήλιο
μα η ψείρα μένει,
η Ελλάς λευτερωμένη
μπροστά τραβάει.

Κι η Παναγιά στα τζάμια χαμογελάει...

Το γκάζι είναι κομμένο
το φως επίσης,
με λαχανίδα σκέτη
άιντε να ζήσεις.

Κι η Παναγιά στα τζάμια μας ευλογάει...

Το θάμα το μεγάλο
μας φέρνει γούρι,
μπομπότα και πλιγούρι
με το δελτίο.

Κι η Παναγιά στα τζάμια να μας κοιτάει...

Εδώ ο Άι Στράτης
και κει η Αθήνα
εκεί ακούς βαλσάκια
μα εδώ έχει πείνα.

Κι η Παναγιά στα τζάμια δε μας κοιτάει, φαίνεται δακρυσμένη, παραμιλάει...";1;1977
Η αγωγή του πολίτου;Το παραμύθι αρχινά;Κριμιζάκης Γιώργος;Κακουλίδης Γιάννης;Μαρίνος Γιώργος;LYRA ( EL );1975-07-01;"Το παραμύθι αρχινά
και όμοια τελειώνει
μια ζωή κακομοιριά
και τρύπιο παντελόνι.

Ωραία η Ελλάδα μας
σαν πεταχτή κοπέλα
κι από την πόλη έρχομαι
και στην κορφή κανέλλα.

Το πρόβλημα είναι σοβαρό
θέμα ζωής θανάτου
αυτή πηγαίνει στο γιατρό
κι αυτός πάει καλλιά του.

Ωραία η Ελλάδα μας
σαν πεταχτή κοπέλα
κι από την πόλη έρχομαι
και στην κορφή κανέλλα.

Το παραμύθι αρχινά
και όμοια τελειώνει
καλός καιρός στα Γρεβενά
και στην Αθήνα χιόνι.

Ωραία η Ελλάδα μας
σαν πεταχτή κοπέλα
κι από την πόλη έρχομαι
και στην κορφή κανέλλα.";1;1975
Τα τραγούδια του Καραγκιόζη;Τους ξανάδα;Κραουνάκης Σταμάτης;Κακουλίδης Γιάννης;Κραουνάκης Σταμάτης;POLYDOR ( DE );1996-10-01;"Τους ξανάδα τους ξανάδα
Τους ξανάδα μαζωμένους
Ζωντανούς κι αποθαμένους
Τους ξανάδα τους ξανάδα
Αγαπημένους
Τους ξανάδα τους ξανάδα
Έναν ένα στο σοκάκι
Μάρκο και Καραΐσκάκη
Τους ξανάδα

Καθισμένο σε κοτρόνι
Βλέπω τον Κολοκοτρώνη
Να γνέφει τι σε μέλει
Όλα θα'ρθουν γάλα μέλι
Τους ξανάδα

Τους ξανάδα αρματωμένους
Στις ραχούλες σκαλωμένους
Έτοιμους στο βουναλάκι
Να σηκώσουν μπαϊράκι

Τους ξανάδα μαζωμένους
Τους ξανάδα ματωμένους
Τους ξανάδα τους ξανάδα
Τους ξανάδα ανεβασμένους
Τους ξανάδα ξεχασμένους
Στην Ελλάδα";1;1996
Τα τραγούδια του Καραγκιόζη;Κωλοτούμπα;Κραουνάκης Σταμάτης;Κακουλίδης Γιάννης;Μενιδιάτης Μιχάλης;POLYDOR ( DE );1996-10-01;"Τώρα που 'ρθαν όλα τούμπα
Μια Ελλάδα κωλοτούμπα
Έλα απάνω μου κι ακούμπα
Τώρα που 'ρθαν όλα σκούρα
Ο καθένας μια φιγούρα
Ο καθένας μια καμπούρα

Τώρα που 'ρθε κούφια η ώρα
Εποχή θανατηφόρα
Καραγκιόζη μου προχώρα
Ήρωά μου
Φόρα επάνω σου
Τα όνειρά μου λατρεμένη μου σκιά

Κρεμασμένο σε καλούμπα
Πέταγα πάνω απ' τη Τρούμπα
Έλα απάνω μου κι ακούμπα
Κρεμασμένο στα φεγγάρια
Σ' είδα σκλάβα στα παζάρια
Να σε παίζουνε στα ζάρια

Κρεμασμένο σ' ένα ψέμα
Άσ' το μη το κάνεις θέμα
Ξέρω, σ' έχω μες στο αίμα
Έρωτά μου
Είμαι τρύπα σ' ένα κέρμα
Γκόμενά μου
Της ζωής μου συντροφιά

Κι όπως πέφτει το σκοτάδι
Και ανάβει σαν καράβι
Ο μπερντές μας κάθε βράδυ
Στο ντιβάνι
Κι οι σκιές μας στο ταβάνι
Έρωτά μου
Ζωγραφίζουν δυό παιδιά";1;1996
Μαλακά πιο μαλακά;Ελλάδα η χώρα του πράσινου ήλιου;Κριμιζάκης Γιώργος;Κακουλίδης Γιάννης & Κλυνν Χάρρυ;Κλυνν Χάρρυ;COLUMBIA - EMI ( EL );1984-05-01;"Ελλάδα η χώρα του πράσινου ήλιου
του ΠΑΟΚ, της ΑΕΚ, της Καλαμαριάς,
πατρίδα θρησκεία, σουβλάκι με πίτα,
Datsun, Adidas και χάνι της Γραβιάς.

Τσαρούχι, Rolex, σνακ μπαρ,
ρεπόρτερς και Τζέι Αρ,
με Honda η Ελλάδα προς την δόξα τραβά,
με Marx, Ορθοδοξία και με μια ζεϊμπεκιά
να την η Ελλάδα ανάσκελα...

Ελλάδα η χώρα του πράσινου ήλιου
του ΠΑΟΚ, της ΑΕΚ, της Καλαμαριάς,
πατρίδα θρησκεία, σουβλάκι με πίτα,
Datsun, Adidas και χάνι της Γραβιάς.

Έλληνες, πού οδηγείται η πατρίς σήμερα;
Ποιος κυβερνά αυτόν τον τόπο;
Ποιός τον γ(μπιιιιμπ) αυτόν τον τόπο;

Ελλάδα η χώρα του πράσινου ήλιου
του ΠΑΟΚ, της ΑΕΚ, της Καλαμαριάς,
πατρίδα θρησκεία, σουβλάκι με πίτα,
Datsun, Adidas και χάνι της Γραβιάς/

Ξεσηκωθείτε Έλληνες, ξεσηκωθείτε πατριώτες ! 
Παιδιά σηκωθείτε να βγούμε στους δρόμους
με Rolex στα χέρια με γούνες στους ώμους.
Ίτε παίδες Ελλήνων υπέρ βωμών και εστιών,
υπέρ πατρίδος και θεών,
υπέρ αναπαύσεως των ψυχών ημών.
Υπέρ αγοράς Super Market Electric,
υπέρ Prisunic Μαρινόπουλος.
Αναφωνήσατε λοιπόν μετ' εμού:
""Ζήτω ο στρατός, ζήτω ο Κούδας,
ζήτω το ευγενές άθλημα της ιστιοπλοίας
Κάτω η φαυλοκρατία Ζήτωωωω (σφαλιάρα)
κάτω οι αντίχριστοι, κάτω η ψευδής διανόησις,
κάτω Πετράλωνα, Κάτω Τούμπα
κάτω στον Πειραιά στα Καμίνια

Ελλάδα η χώρα του πράσινου ήλιου
του ΠΑΟΚ, της ΑΕΚ, της Καλαμαριάς,
πατρίδα θρησκεία, σουβλάκι με πίτα,
Datsun, Adidas και χάνι της Γραβιάς.

Έλληνες κινδυνεύουμε,
οι ανθέλληνες αφανίζουν τα όσια και τα ιερά μας
στην Ακρόπολη θα υψώσουν το σφυροδρέπανο
στον Λευκό Πύργο θα υψώσουν τη σημαία της Κίνας
στη Μητρόπολη θα αναρτήσουν τη φωτογραφία του Γιαρουζέλσκι
και στον Πειραιά στο στάδιο Καραϊσκάκη
θα υψώσουν τη σημαία της Δυναμό Μόσχας

Έχομεν ιεράν υποχρέωσιν Έλληνες,
όπως σώσομεν την πατρίδα
από κάθε είδους ολοκληρωτισμόν

Αυτή η χώρα ρε μάγκα δε σώζεται με τίποτις άμα λάχει να ούμε…";1;1984
 7'' - 45 στροφών;Πότε θα 'ρθει η Κυριακή;Καλαϊτζής Ηλίας;Καλαϊτζής Ηλίας;Καλαϊτζής Ηλίας & Χαλκιάς Δημήτρης;RCA VICTOR ( US );1964-05-30;"Κάθε μέρα στην δουλειά
έχω πόνο στην καρδιά,
πόνος και με δέρνει η μέρα
λείπεις εσύ και με πετάς.

Πότε θα 'ρθει η Κυριακή
να σ' ανταμώσω το πρωί,
να σ' ανταμώσω το πρωί
αχ πότε θα 'ρθει η Κυριακή;

Όλα τα πλούτη στη ζωή
τα έχεις κούκλα μου εσύ.
Δε σ' αλλάζω με τ' αστέρια
είσαι για μένα η αυγή.

Πότε θα 'ρθει η Κυριακή
να σ' ανταμώσω το πρωί,
να σ' ανταμώσω το πρωί
αχ πότε θα 'ρθει η Κυριακή;

Σ' όλο τον κόσμο θα το πω
που μ' αγαπάς και σ' αγαπώ.
Δε θα βρεθεί μέσ' στην Ελλάδα
άλλο ζευγάρι ταιριαστό.

Πότε θα 'ρθει Κυριακή
να σ' ανταμώσω το πρωί,
να σ' ανταμώσω το πρωί
αχ πότε θα 'ρθει Κυριακή;";1;1964
Οι Μάηδες οι ήλιοι μου;Μετανάστης;Γερασιμίδης Γιώργος;Καλατζόπουλος Γιώργος;Νταλάρας Γιώργος;MINOS ( EL );1978-04-11;"Είπες πως θα ρίξεις μαύρη πέτρα στην Ελλάδα
είπες πως θα γίνεις Ευρωπαίος Γερμανός
μπήκες στο βαπόρι μια Τετάρτη με λιακάδα
κι όσο πάει μαυρίζει ο ουρανός

Μετανάστη μάθε κάτι
γαλλικά γερμανικά
ίδια ειν' τ' αφεντικά
κι ίδια κλέβουν τον εργάτη

Είπες πως θα ρίξεις μαύρη πέτρα στη μιζέρια
είπες πως θα βγάζεις τον παρά με την ουρά
έβαλες στις τσέπες μοναχά τα δυό σου χέρια
πας να τα πουλήσεις φουκαρά

Μετανάστη μάθε κάτι
γαλλικά γερμανικά
ίδια ειν' τ' αφεντικά
κι ίδια κλέβουν τον εργάτη";1;1978
Τα δέοντα;Ο Νικόλας ο Μεμάς;Καλογερόπουλος Νίκος;Καλογερόπουλος Νίκος;Καλογερόπουλος Νίκος;FM RECORDS;1995-01-01;"Είμ' ο Νικόλας ο Μεμάς
Μάννα μου είναι η Ελλάς
είμαι κι εγώ μαζί μ' εσάς
στο ίδιο το καράβι.

Άιντε γεια μας ρε παιδιά
άιντε γεια μας κι ο Θεός
πάντα στο καλό
άιντε γεια μας ρε παιδιά
και του χρόνου τέτοια μέρα
να 'μαστε καλά.

Είμ' ο Νικόλας ο Μεμάς
το ίδιο ντέρτι έχω μ' εσάς
άκου, το λέει ο μπαγλαμάς
άκου και θα το γιάνει.

Είμ' ο Νικόλας ο Μεμάς
σου τραγουδάω από καρδιάς
κοίτα τι γίνεται μ' εμάς
όλα περνούν και φεύγουν.";1;1995
;Είναι ο καημός ελπίδα;Μεταξάς Μιχάλης;Καλομοίρης Πέτρος;Χιντιράκης Γιώργης;;2000-01-01;"Είναι στιγμές που βρίσκεται
στο δροσερό μας χέρι
ένα φτερό ανάερο
σαν κοφτερό μαχαίρι

Είναι ανάγκη ο καημός
είν' ο καημός ελπίδα
το σβήσιμο του γέλιου μας
μπόρα και καταιγίδα

Αρμύρα ! φως ! τα κάστρα μας
Ελλάδα Πόνος Γνώση
Γλώσσα Τραγούδι Μουσική
Ειρήνη θα μας δώσει

Είναι το βλέμμα μας το φως
σαν πεταλούδα μοιάζει
φεύγει ! γυρνά ! ξανάρχεται
και δεν κατασταλάζει

Πλημμύρα νιότης η άνοιξη
λιάζει και το χειμώνα
ένας απέραντος ανθός
το φως του Παρθενώνα

Αρμύρα ! φως ! τα κάστρα μας
Ελλάδα Πόνος Γνώση
Γλώσσα Τραγούδι Μουσική
Ειρήνη θα μας δώσει";1;2000
