Τίτλος του δίσκου;Τίτλος τραγουδιού;Συνθέτης;Στιχουργός;Τραγουδιστής;ΕΤΑΙΡΕΙΑ;Ετος κυκλοφ.;Στίχοι;Εκτέλεση;Χρόνος
The Harry Klynn files ανάποδα;Τι είναι η πατρίδα μας;Τσακνής Διονύσης;Μπαλαφούτης Ευάγγελος;Κλυνν Χάρρυ & Χορωδία;MERCURY RECORDS ( US );1997-07-01;"Τι είναι η πατρίδα μας;

Τι είναι η πατρίδα μας;
τηλεφώνησε τώρα, στο 090 22 22 22
Τι είναι η πατρίδα μας;
Έλα ντε
Ποιανού ρε μάγκες τα μάτια που βλέπετε στην οθόνη σας; Του έτσι, του αλλιώτικού του πασαλιμανιώτικου, ή του περιπτερά της γειτονιάς;
Η ερώτησης είναι σαφής, τι είναι η πατρίδα μας;
Σας ακούμε

Σκαρίβαλα και κονιγιά
Λαμπίρια και βουνάτες
Αναταρούδια σαλαγιά
Και δόνητες φωνάτες

Η πατρίδα μας, είναι ένα τέτοιο, με αυτό και έχει από πάνω ένα άλλο... αυτό είναι η πατρίδα μας, η Ελλάδα
(Σημίτης) Η Ελλάδα δε διεκδικεί τίποτε αλλά δεν παραχωρεί τίποτε
Φοβερό!!! Και που να ακούσεις την συνέχεια μεγάλε
(Σημίτης) Θέλω να ευχαριστήσω, την κυβέρνηση των Ηνωμένων Πολιτειών για την πρωτοβουλία και την βοήθειά της...
Καλά, πιο Ελληνοτουρκικό και πιο Ελληνοβαλκανικό ρε παιδιά, το μεγαλύτερο πρόβλημα στην Ελλάδα είναι το Ελληνοελληνικό, που λένε και οι διπλωματικοί κύκλοι
(Γιαννόπουλος) Οι κύκλοι είναι οι ρουφιάνοι
Καλά ε, πώρωση
τι πώρωση ρε τεράστιε, σκέτη οστεοπόρωση
Διαλιέχτε
Τι είναι η πατρίδα μας;

Σκαρίβαλα και κονιγιά
Λαμπίρια και βουνάτες
Αναταρούδια σαλαγιά
Και δόνητες φωνάτες

Διαλιέχτε
(Παγιατάκη) Γεια σας, είμαι η Βίκυ Παγιατάκη
Στα παπάρια μας
Διαλιέχτε
Ποιο από τα δύο, τα αριστερό ή το δεξί
(Κοινό) Μπουλντόζα χρειάζεται η Ελλάδα
Κι εγώ μαζί σου είμαι ογκόλιθε
Με ποια ομάδα είμαστε ρε τρισδιάστατε;
(Κοινό) Καρδίτσα Καρδίτσα!!
Τι είναι η πατρίδα μας;
Η πατρίδα μας, είναι ένα τέτοιο με ένα αυτό κι έχει από πάνω ένα άλλο… αυτό είναι η πατρίδα μας, η Ελλάδα
(Δαμανάκη) Είναι όραμα, Δεν είναι σήμερα
(Σημίτης) Η Ελλάδα διεκδικεί...
Επιτέλους, να και μια φορά που διεκδικούμε
(Σημίτης) την κυβέρνηση των Ηνωμένων Πολιτειών
Πλάκα μας κάνεις ρε μεγάλε.!!!
(Σημίτης) Αλλά δεν παραχωρεί τίποτε...
Τώρα δέσαμε...
Ωχ, το μάτι μου...
Μπορούμε να κοιτάμε τον Έλληνα στα μάτια
Για κοίτα με στα μάτια, μάτια λοιπόν κι εξηγήσου
(Καραμνλής) Το άγρυπνο μάτι του νεοδημοκράτη θα μας παρακολουθεί
Κάποιος να μας ξεματιάσει ρεεε
Τι είναι η πατρίδα μας;
Ελλάδα σου λέει μετά, δεν είναι να κυκλοφορείς στο δρόμο ντρέπεσαι!!!
Ήθελα να 'ξερα αν ζούσε ο Διονύσιος Σολωμός τι εθνικό ύμνο θα έγραφε τώρα!!!
Αυτό είναι η πατρίδα μας; Κι εγώ νόμιζα ότι ήταν το άλλο... το αυτό... το τέτοιο...

Σκαρίβαλα και κονιγιά
Λαμπίρια και βουνάτες
Αναταρούδια σαλαγιά
Και δόνητες φωνάτες

Επαναλάβατε

Σκαρίβαλα και κονιγιά
Λαμπίρια και βουνάτες
Αναταρούδια σαλαγιά
Και δόνητες φωνάτες";1;1997
Αψέντι;Μενεξές;Σούκας Τάκης;Μπαλαχούτης Κώστας;Μαργαρίτης Γιώργος;ΔΙΚΤΥΟ;2005-04-28;"Στη Σμύρνη ήσουν μενεξές
στο Ναύπλιο αγέρας.
Στην Ήπειρο στις εμπασιές
ο ήχος της φλογέρας.

Στον Πειραιά τα χρόνια σου
τα ξόδεψες στα ζάρια.
Γουλιά γουλιά χαθήακνε
της νιότης τα σημάδια.

Είσαι παντού και πουθενά
σε όλη την Ελλάδα
κι όπου πηγαίνεις μάγκα μου
σκοτούρα και ζαλάδα.

Στη Σαλονίκη μια βραδιά
τα'βαλες με καμπόσους.
Στη Λάρισα με τα θεριά
πάλεψες μ'άλλους τόσους.

Στο Βόλο μου 'παν έσβησες
σ' ένα χορό απάνω
ενώ στους γύρω φώναζες
απόψε θα πεθάνω.";1;2005
Ξεριζωμός 91 χρόνια μετά;Δεν τελειώνουμε ποτέ;Παπαδόπουλος Χρήστος;Μπαλαχούτης Κώστας;Τσέρτος Μπάμπης & Αναματερού Μαρία & Στάμου Ρένα;ΙΔΙΩΤΙΚΗ ΕΚΔΟΣΗ;2013-01-01;"Τα καλκάνια του Βοσπόρου είναι νόστιμα
Και τα σύκα απ' τ' Αϊδίνι πεντανόστιμα.
Καρυδόψιχα απ' το Μπέικος, σύκα απ' το Ερζερούμ
Και μετάξι απ' την Πόλη να χαρείς γιαβρούμ ! 

Στη χαραμάδα του μυαλού κρύβω τη Μικρασία
Τη Σμύρνη και το Αϊβαλί, την Προύσα, την Επισκοπή, βαριά μελαγχολία.
Όλα βαλμένα στην καρδιά μέσα απ' τα παραμύθια
Που μου 'λεγε η γιαγάκια μου και μου 'σβηναν τα στήθια

Δεν τελειώνουμε ποτέ
Έχει η καρδιά μας αίμα.
Κάνει την πίκρα αμανέ
Βάζει φωτιά στο ψέμα.

Πρώτα πλύνε τη λακέρδα, στράγγιξε το αίμα
Κόψε σε ρολό το ψάρι φέτες, έναένα.
Πέρασε γλυκά το τσάκνο, βγάλε το μεδούλι
Μην το πεις όμως ποτέ σου, μη το μάθουν ούλοι.

Στα βάθη μέσα του μυαλού κρύβεται μια Ελλάδα
Ένας διωγμός, μία φυγή, ένα τσιγάρο διαδρομή, στα μάτια μου γυαλάδα.
Όλα βαλμένα στην καρδιά μέσα απ' τα παραμύθια
Που μου 'λεγε η γιαγάκια μου και μου 'σβηναν τα στήθια

Δεν τελειώνουμε ποτέ
Έχει η καρδιά μας αίμα.
Κάνει την πίκρα αμανέ
Βάζει φωτιά στο ψέμα.";1;2013
Ζούμε τις μεγάλες μέρες;Μαχαίρι η αγάπη;Παπαδόπουλος Χρήστος;Μπαλαχούτης Κώστας;Πεΐδη Μαρία & Λεκόπουλος Γιάννης;PANIK OXYGEN;2023-01-01;"Τα χρόνια μου καράβια όπου ταξιδεύουν
στου κόσμου τα λιμάνια να σε γυρεύουν.
Κλεμμένες οι λιακάδες που μου φανέρωσες
δεν έχω πια Ελλάδες, δεν έχω άλλες έρωτες.

Μαχαίρι η αγάπη κι οι δυό κοπήκαμε
μες στη φωτιά παραδοθήκαμε,
σαν πεφταστέρια που δεν τα βρήκαμε,
σαν τα καλοκαίρια που δεν ξεχαστήκανε.

Σαν λεύκα μες στο χιόνι μ' εγκατέλειψες
της γης η ανεμώνη ξέρει πως έλειψες.
Δεν ήμουν η ρωγμή σου και ποτέ δεν έγινα
φωτιά και αφορμή σου για πάντα έμεινα.

Μαχαίρι η αγάπη κι οι δυό κοπήκαμε
μες στη φωτιά παραδοθήκαμε,
σαν πεφταστέρια που δεν τα βρήκαμε,
σαν τα καλοκαίρια που δεν ξεχαστήκανε.";1;2023
Η γιαγιά μου μαγειρεύει όνειρα τηγανητά;Μπλούζα με μια στάμπα;Παπαδόπουλος Λάκης;Μπαλτζή Sunny;Αρλέτα & Παπαδόπουλος Λάκης;FEELGOOD RECORDS;2018-01-01;"Μπλούζα με μια στάμπα 
τη σκισμένη τσάντα,
μόνο εσένα θέλω 
βάλε ένα καπέλο.

Δροσερό φιλί 
δεν θέλω πιο πολύ 
αγάπη, μια λιακάδα, Ελλάδα. 

Βγάλε απ' την καρδιά σου 
εκείνα που δεν λέγονται, 
κάτω από τον Ηλιο 
και οι μαύρες σκέψεις καίγονται. 

Δροσερό φιλί 
δεν θέλω πιο πολύ 
αγάπη, μια λιακάδα, Ελλάδα. 

Ξέχνα τους χειμώνες 
πέτα τους στο κύμα, 
απ' τα όνειρα μας 
μόνο ένα βήμα.

Δροσερό φιλί 
δεν θέλω πιο πολύ 
αγάπη, μια λιακάδα, Ελλάδα.";1;2018
Δικαίωμα μου;Η εθνική των μουσικών;Καφετζόπουλος Γιώργος;Μπαμπάνης Χρήστος;Πανταζής Λευτέρης;RCA;1995-01-01;"Κλείσε μου στον παράδεισο τραπέζι Βαμβακάρη
ένα Σαββατοκύριακο για να 'ρθει να με πάρει
ο Χιώτης που μου το 'ταξε ο πιο παλιός κει πάνω
ν' ακούσω τον Τσιτσάνη μας και το μυαλό να χάνω.

Η εθνική των μουσικών μας λείπει και πονάμε
όμως με τα τραγούδια της τον πόνο μας ξεχνάμε.
Τσιτσάνης και Ζαμπέτας μας, Μητσάκης, Παπαϊωάννου
η εθνική Ελλάδας μας μένει τώρα κει πάνου.

Κλείσε μου στον παράδεισο τραπέζι με το Στράτο
ένα Σαββατοκύριακο να 'ρθουν τα πάνω κάτω
να γίνει πιά τρικούβερτο με όλους ένα γλέντι
με άδεια απ' του παράδεισου του άγιου αφέντη.

Η εθνική των μουσικών μας λείπει και πονάμε
όμως με τα τραγούδια της τον πόνο μας ξεχνάμε.
Τσιτσάνης και Ζαμπέτας μας, Μητσάκης, Παπαϊωάννου
η εθνική Ελλάδας μας μένει τώρα κει πάνου.";1;1995
Δεν ανήκω εδώ;Κάτι να αλλάξεις;Μπαμπανιάρης Βασίλης;Μπαμπανιάρης Βασίλης;Μπαμπανιάρης Βασίλης;COBALT MUSIC;2013-01-01;"Καμένη πολη, ίδιοι οι ρόλοι και στις δουλειές μας πρωίπρωί
Άγνωστοι μπάτσοι, γνωστοί Απάτσι, καίνε ιδέες και ηθική
Δημοκρατία, τρομοκρατία, ασυδοσία και παρακμή
Κι όλα είναι ίδια, αποκαϊδια, χωρίς ουσία και λογική...

Θέλεις να βγεις να φωνάξεις, αυτά που φοβάσαι να πεις
Μα αν θέλεις κάτι να αλλάξεις, θα πρέπει να μάθεις να διεκδικείς
Σήκω και μάθε να ζεις!

Μικρή οθόνη, μεγάλη αγχόνη και στο μυαλό σου λοβοτομή
Γκόμενες φέτες, σα μαριονέτες τα πόδια ανοίγουν μες στο γυαλί
Μέντορες κάφροι, δημοσιογράφοι, μασόνοι, λέσχες, πολιτικοί
Ελλάς θρησκεία, συνομωσία, υποκρισία για μια ζωή...

Θέλεις να βγεις να φωνάξεις, αυτά που φοβάσαι να πεις
Μα αν θέλεις κάτι να αλλάξεις, θα πρέπει να μάθεις να διεκδικείς
Σήκω και μάθε να ζεις!

Σήκω και μάθε να ζεις

ΜΑΘΕ να ΔΙΕΚΔΙΚΕΙΣ !";1;2013
Χρυσάνθη και οι φανταστικοί της φίλοι;Ο νονός;Μπαρέλη Χρυσάνθη;Μπαρέλη Χρυσάνθη;Μπαρέλη Χρυσάνθη;LYRA ( EL );2011-02-16;"Κάθε γιορτή στολίζεις τη πόλη μου με φώτα
να δώσεις στην απάτη σου ευχάριστη νότα

Ύψωσες δέντρο όμορφο στη μέση της πλατείας
μα στην Ελλάδα ζω εγώ, όχι στην Ελβετία

Νονέ μου η κοιλάρα σου μοιάζει με του χοντρού
των Χριστουγέννων τη μασκότ, κτήμα αναψυκτικού

Refren
Μα δε γαμιέσαι ρε νονέ, με βάφτισες στο ψέμα
που υπόσχεσαι και ορκίζεσαι πως νοιάζεσαι για μένα
κι αντί να πάρω σαν παιδί απ'το νονό το δώρο
τα πλούσια σου γεύματα εγώ να τα πληρώνω

Η γαλοπούλα θα μου πεις τι θέλει στο τραπέζι
αυτόι οι ξένοι αφέντες σου πάντα να 'ναι στη μέση;

Μου έβγαλες και προσφορές, δάνεια και εκπτώσεις
και χρεωμένη βγήκα εγώ το δώρο πριν μου δώσεις

Μου ευχήθηκες καλή χρονιά και μου'ταξες παπάδες
πιο σοκ με νέα σκάνδαλα και όργια αράδες

Refren
....
τα σπίτια σου, τις διακοπές εγώ να τα πληρώνω";1;2011
Quark;Νέα γενιά;Μπέκος Θωμάς & Μπέκος Ευριπίδης;Μπέκος Θωμάς;Μπέκος Θωμάς & Μπέκος Ευριπίδης;UNIVERSAL MUSIC;2012-10-21;"Αυτού του κόσμου οι καημοί, λουλουδιών ειν' ανθοί
στην καρδιά μου ανοίγουν
ήμουνα νιός ξεχωριστός, τώρα γέρος και φτωχός
πικρό ταξίδι θλίψης
στη χώρα αυτή των κεραυνών, τη σιωπή των αμνών
Πως να την αντέξω.

Ελλάδα ζεις ένα κλισέ, δημοκρατία βερεσέ
σου στήσανε καημένη
γίναμε δούλοι, δουλικά, υποκλινόμαστε ευλαβικά
για να μας πηδάνε
πέντε ρίζεςριζικά αγκάλιασαν σαν ξωτικά
τ' αγέρι σου Ελλάδα.

Παλεύω καθημερινά μα η ζωή με προσπερνά
η σκόνη της μου μένει
στο σπίτι μου που το χρωστώ, για ακροκέραμο έχω εγώ
την κόρη του ματιού μου
αλλά δε στέλνω SMS ούτε εκπέμπω SOS
τα μάτια μου δεν κλείνω.

Νέα γενιά, νέα γενιά
μη βολεύεσαι άλλο πια
στο λαιμό γίνε θηλιά, νέα γενιά.";1;2012
Γειά σου ρε Ελλάδα;Γειά σου ρε Ελλάδα;Μπήτρος Νεκτάριος;Μπήτρος Νεκτάριος;Ραζής Στέλιος;EXIS MUSIC;2007-01-01;"Μαρόκο Τυνησία και σ' όλη την Ασία
Τον Ερωτα πουλάνε στην στιγμή
Αθήνα Σαλονίκη και σ' όλο τον Περαία
Στον Ερωτα ποντάρουν τη ζωή

Γεια σου ρε Ελλάδα χώρα της αγάπης και του έρωτα
Που μαζί σου ζούμε σε βράδια αξημέρωτα
Γεία σου ερωτά μου
Και μπράβο στη καρδιά μου που σ' αγάπησε
Νόημα στην ζωή μου η αγάπη σου μου χάρισε

Ρε Έλληνες γλεντάτε με εκείνες που αγαπάτε
Να ζήσετε όπως πρέπει την ζωή
Τα χρόνια μας περνάνε και πίσω δε γυρνάνε
Μη βάζετε μαράζι στην ψυχή.";1;2007
Ο Ερωτας σου θάλασσα;Αχ ! Ελλάδα;Μπίγαλης Κώστας;Μπίγαλης Κώστας;Μπίγαλης Κώστας;RCA;1996-05-01;"Αχ, οι φόροι, αχ, οι δείχτες
Αχ, οι φορομπήχτες.
Αχ, λιτότης, αχ, ακρίβεια
κάθε χρόνο μια από τα ίδια.

Αχ, η σύγκληση τραβάει
και δεν ξέρω που το πάει.
Διαβλέψεις και προβλέψεις
κι' άμα βγούνε να με χαι... ρετήσεις
κλέφτικα, μωρέ κλέφτικα.

Αχ, Ελλάδα σε πονάω
κι όποιος πει δε σ' αγαπάω
πες του μόνο τόσα χρόνια
αχ, για 'σένα τι τραβάω.

Αχ, Ελλάδα του Αιγαίου
και του φύλλου του ωραίου.
Αχ, Ελλάδα της Μυκόνου
και του πονηρού διακόνου.

Αχ, Ελλάδα των πλουσίων
και των νηστευτών οσίων.
Αχ, Ελλάδα της αργίας
και του δείκτη ανεργίας.
Αχ Ελλάδα της συμπόνιας
του καημού και της διχόνοιας.

Αχ, Ελλάδα σε πονάω
κι όποιος πει δε σ' αγαπάω
πες του μόνο τόσα χρόνια
αχ, για 'σένα τι τραβάω.
";1;1996
Βάλε το ράδιο στη διαπασών;Βασάνιζε με συνεχώς;Ανδρεάδης Θέμης;Μπίκας Λάζαρος;Ανδρεάδης Θέμης;ΦΑΛΗΡΕΑ ΑΦΟΙ;1986-01-01;"Μικρέ γλυκέ μου δολοφόνε,
Πως μοιάζεις με τον Αλ Καπόνε,
άσε στον άσσο το καπέλλο
πάρε τσιγάρο, εκεί σε θέλω.

Γυαλίζεις μπριγιαντίνη,
σβήσε τα ίχνη απ' το λουστρίνι,
κανείς να μην το μάθει
πως είσ' εδώ γιατί εχάθη.

Βάλε το ράδιο στη διαπασών
και άιντε, σβέλτα, κάνε με απών, κάνε με απών.

Στο βρωμερό σου πολυβόλο,
δυο σκόνες λάμπουν όλο κι όλο
και με θαμπώνει η γυαλάδα,
Πως με σκοτώνει η Ελλάδα.

Γυαλίζεις μπριγιαντίνη,
η ευαισθησία σου σε φτύνει
και ο εγωισμός σου
σε λέρωσε με το κραγιόν.

Βάλε το ράδιο στη διαπασών
και άιντε, σβέλτα, κάνε με απών, κάνε με απών.

Μικρέ γλυκέ μου δολοφόνε,
Πως μοιάζεις με τον Αλ Καπόνε,
μη με σκοτώνεις με την πρώτη,
βαοάνιζέ με συνεχώς ότι πεις ";1;1986
Σίμος Κουσκούνης;Ταξίδι η Ελλάδα;Κουσκούνης Σίμος;Μποζώνη Κατερίνα;Κουσκούνης Σίμος;;2004-01-01;"Πάρε της αγάπης τρένο θα σε περιμένω
Στου λόφου το ξωκλήσι δεν υπάρχει δύση
Ειν' η ώρα που οι αγγέλοι σεργιανούν

Κάθε πέτρα και λιθάρι σαν μαργαριτάρι
Σε κάμπους και λαγκάδια δίδυμα φεγγάρια
Στις πηγές Θεοί και όνειρα ξεδιψούν

Ταξίδι είναι η Ελλάδα ταξίδι μέσ' στο φως
Κι αν φαίνεται να νυχτώνει εδώ μόνο ξημερώνει
Πάντα ο ουρανός

Ταξίδι είναι η Ελλάδα ταξίδι μεσ' στο φως
Κι αν φαίνεται να δακρύζει εδώ πάντα θα γυρίζει
Κοντά της ένας Θεός

Πάρε της αγάπης πλοίο πες στον πόνο αντίο
Και πάμε σ' ακρογιάλι θα ' ρθουνε κι οι γλάροι
Είν' η ώρα που τα κύματα τραγουδούν

Τα κοχύλια ξαπλωμένα θα 'ναι μεθυσμένα
Του έρωτα το χρώμα πίνουνε ακόμα
Πάμε τώρα που τα αστέρια μας οδηγούν";1;2004
Κόκκινη κλωστή;Κυριακή μεσημέρι;Μπονάτσος Ανδρέας;Μπονάτσος Ανδρέας;Αρβανίτη Σοφία;RCA;1998-01-01;"Θα σε πάω μια βόλτα, μωρό μου,
στο παλιό εφηβικό όνειρό μου,
για ουζάκι στο Μοναστηράκι
και για χάζι στους πλανόδιους στο Γκάζι.

Κυριακή μεσημέρι κι εμείς χέρι χέρι μαζί,
Κυριακή μεσημέρι κι η Ελλάδα το ξέρει και ζει.
Κυριακή μεσημέρι κι εμείς χέρι χέρι, γιορτή,
τέτοια χώρα διαλέγει αιώνες η αγάπη και ζει.

Έχει Ηλιο κι η Αθήνα χαζεύει,
τέτοια ώρα κανείς δε δουλεύει.
Και μ' αρέσει να με πιάνεις απ' τη μέση
και να με κοιτάς χωρίς να λες μια λέξη.

Κυριακή μεσημέρι κι εμείς χέρι χέρι μαζί, ...

Κι όταν πέσει ξανά το βραδάκι
θα φορώ το δικό σου σακάκι,
έχει πιάσει λίγη ψύχρα και μ' αρέσει.
Τα καλά της η ψυχή μου έχει φορέσει.

Κυριακή μεσημέρι κι εμείς χέρι χέρι μαζί, ...";1;1998
Μακριά σου;Η σκιά μου κι εγώ;Μποσκαΐνος Δημήτρης;Μποσκαΐνος Δημήτρης;ΔΥΤΙΚΕΣ ΣΥΝΟΙΚΙΕΣ;ALPHA RECORDS ( EL );2003-12-01;"Πέφτει η νύχτα στην πόλη, δυό χαμένα κορμιά
Που κορόιδευαν όλοι όταν ήταν παιδιά
Δυο χλωμές αναμνήσεις κρύφτηκαν στα σκουπίδια
Με τις ίδιες κινήσεις δύο πρόσωπα ίδια

Χαμένος τουρίστας χωρίς ξεναγό
Σε μια ξένη Ελλάδα που πρέπει να ζω
Νταλίκα που τρέχει χωρίς οδηγό
Είν' η σκιά μου κι εγώ

Δυο ενώσεις σε μια, μπερδεμένη χημεία
Έκρηξη και φωτιά μέσα στην ησυχία
Να μετράνε το χρόνο μέχρι ο ήλιος να βγει
Ταξιδεύουνε μόνο κάθε νύχτα μαζί

Χαμένος τουρίστας χωρίς ξεναγό
Σε μια ξένη Ελλάδα που πρέπει να ζω
Νταλίκα που τρέχει χωρίς οδηγό
Είν' η σκιά μου κι εγώ";1;2003
Ας πρόσεχες;Τι είναι η πατρίδα μας;Ρακιντζής Μιχάλης;Μπουλάς Σάκης;Μπουλάς Σάκης;CBS;1988-01-01;"Τι είν' η πατρίδα μας
Μην είναι οι κάμποι
Μην είν' τα οικόπεδα, μην είναι βουνά
Μην είν' δασάκι που το καίνε και λάμπει
Φιλέλληνες...

Μην είν' θρησκεία με θεό το Γκάλη
Ολυμπιακάρα και ξερό ψωμί
Και ΠΑΟ ΟΛΕ και γκολ με το τσουβάλι
Και τρίποντα...

Θέλω να μένω πάντα στην Ελλάδα
Ν' ανοίγω τρύπες για να βρω μετρό
Και τα ταξί να καίνε φασολάδα
Και κάρβουνο...

Μην είν' τα έθιμά μας που αλλάζουν
Πιάτα στην πίστα και BMW χρυσή
Κατεψυγμένα τα αρνάκια που σφάζουν
Στα Σάλωνα...

Και οι τουρίστες το φιλότιμό μας
Με Polaroid κάνουν καρτποστάλ
Κι αυτοί μας πιάνουνε τον Κολοσσό μας
Γι' αντάλλαγμα...

Θέλω να μένω πάντα στην Ελλάδα
Ν' ανοίγω τρύπες για να βρω μετρό
Και τα ταξί να καίνε φασολάδα
Και κάρβουνο...

Μην είναι είναι μέλισσες και Μαστρογιάννη
Μην είν' ο αρχαίος μας πολιτισμός
Μην είναι ματ με γυαλισμένα κράνη
Και βούρδουλας...

Γέλα πουλί μου, πάλι ξαναγέλα
Κάν' το κορόιδο μη ρωτάς γιατί
Εδώ είν' Βαλκάνια και σαλμονέλα
Και Μπίθουλας...";1;1988
