Τίτλος του δίσκου;Τίτλος τραγουδιού;Συνθέτης;Στιχουργός;Τραγουδιστής;ΕΤΑΙΡΕΙΑ;Ετος κυκλοφ.;Στίχοι;Εκτέλεση;Χρόνος
Ο χρονοποιός;Τα χρυσά παιδιά του Γκάλη;Σαββόπουλος Διονύσης;Σαββόπουλος Διονύσης;Σαββόπουλος Διονύσης;UNIVERSAL MUSIC;1999-12-15;"Τέντες χτυπούσαν το πρωί
πάει το Καλοκαίρι
άιντε στης υδροκέφαλης
το τσιμεντένιο χέρι .

Στην καθημερινή μας ήττα
σ αυτό το σήριαλ που τραβάει
και ξάφνου η Βούλα η Τσιαμήτα
και πέντε Αγγελοι στο πλάι .

Λάμποντας μες στον ουρανό τους
μέρες προπάντως σαν κι αυτές
δεν ξεπερνούν τον διπλανό τους
μα τον εαυτό τους οι αθλητές .

Κι όλοι εμείς μέσα στη ζάλη
με μια θολή προοπτική
να η σημασία του Νίκου Γκάλη
ό , τι νικάει είναι από 'κεί .

Κι έτσι όταν σκιάζομαι
και κουλουριάζομαι
στην νύχτας τον βυθό
και πως να κοιμηθώ ;

Ο νους μου αναπολεί
του Γκάλη τη βολή
μ' ένα αναστεναγμό
λύνομαι κι ηρεμώ .

Δύο η Ελλάδες , η μια εκεί
στο παρτσακλό κανάλι
κι η άλλη αστράφτει εφηβική
και νικηφόρα πάλι .

Φέτο στην πλαζ μας πρωτοείδα
όλους μας με τα κινητά
κι αυτήν τη ροζ , σομόν σελίδα
στα στήθη μας τα τριχωτά .

Κι όλους μας βέβαια σε μια ζάλη
σε μια θολή προοπτική
να η σημασία του Νίκου Γκάλη
ό , τι νικάει είναι από 'κεί .

Κι έτσι όταν σκιάζομαι
και κουλουριάζομαι
στην νύχτας τον βυθό
και πως να κοιμηθώ ;

Ο νους μου ψηλαφεί
του Γκάλη τη μορφή
μ' ένα αναστεναγμό
λύνομαι κι ηρεμώ .
";1;1999
Διονύσης Σαββόπουλος;Τσάμικο;Σαββόπουλος Διονύσης;Σαββόπουλος Διονύσης;Σαββόπουλος Διονύσης;LYRA ( EL );1996-01-01;"Τόσος κόσμος πλάι του πέρασε και τον προσπέρασε
τι να ζητάει επαρχιώτης στην Ομόνοια μες το ψιλόβροχο αρχές του Μάη
Ψυχές πολύβουες κι ούτε ένα πρόσωπο τι καρτεράει κλαρίνα παίζουν
κόσμος γλεντάει η ώρα πάει η ώρα πάει

Ξένος ως και στη χαρά του μεσονύχτι του Σαββάτου
τραγουδάκια μου κατάμονα αν σας αντάμωνα θα 'πεφτα κάτου
στο ρυθμό σας ονειρεύομαι και ξενιτεύομαι στα βήματα του
κάπου εδώ έχω γνωστούς αλλά τέτοιαν ώρα μη βαρύνω τους

Ζήτω η Ελλάδα και καθετί μοναχικό στον κόσμο αυτό
Ελασσώνα Λειβαδιά Μελβούρνη Μόναχο
Αλαμάννα και Γραβιά Αμέρικα
Βελεστίνο Άγιοι Σαράντα Εσκι Σεχήρ
Κώστας Κώστας Μανώλης Πέτρος Γιάννης Τάκης
Πλατεία Ναυαρίνου Διοικητηρίου κι Εξαρχείων
Αλέκος Βασίλης Άγγελος
Μπιζανίου κι Αναλήψεως Αγίας Τριάδος κι 25ης Μαρτίου
η Ελλάδα που αντιστέκεται η Ελλάδα που επιμένει
κι όποιος δεν καταλαβαίνει δεν ξέρει που πατά και που πηγαίνει

Καλωσόρισες πουλί μου μοναξιά ελληνική μου
απ' αγάπη φεύγεις έρχεσαι πηγαινοέρχεσαι σαν την πνοή μου
κι απ' την έρημη την απόσταση παίρνει υπόσταση κάθε γιορτή μου
απ' τους δυό μας ποταμούς θα γευτεί μια νύχτα η έρημος καρπούς";1;1996
Λοκάντα η Ελλάς;Σ' αυτήν τη χώρα;Γιαννόπουλος Χρήστος;Σαγιάς Μάνος;Ζησάκος Παύλος;ΚΑΘΡΕΦΤΗΣ ΗΧΩΝ ΑΛΗΘΙΝΩΝ ( EL );2016-01-01;"Σ' αυτή τη χώρα του καημού και της αγάπης
σ' αυτή τη χώρα που γεννήθηκε ο Σωκράτης
ας τραγουδήσουμε για τους αρχαίους τόπους
για την ελπίδα την ειρήνη τους ανθρώπους,

Σ' αυτή τη χώρα από αίμα ποτισμένη
η ιστορία της με ύμνους θα μας δένει
θα μας θυμίζει τους χαμένους ποιητές μας
τη κάθε νίκη μας στις δύσκολες στιγμές μας .

Σ' αυτή τη χώρα που με φως μας πλημμυρίζει
και σαν θέα ντυμένη στ' άσπρα ξεχωρίζει
ξέρει χορεύει με του φεγγαριού το ντέφι
ειν' η Ελλάδα που σκορπά παντού το κέφι.";1;2016
 7'' - 45 στροφών;Κοντά σου Ελλάδα μου;Πλέσσας Μίμης;Σαντοριναίος Γιώργος;Βλαχοπούλου Ρένα;PARLOPHONE RECORDS ( DE );1965-01-01;"Μοιάζεις νυφούλα όλο δροσιά
στην γαλανή σου φορεσιά
δαντέλες και κοράλια
Εχει ευλογήσει η Παναγιά
την κάθε σου βουνοπλαγιά
και τ'άσπρα σου ακρογιάλια

Θά 'ρθω τα βράδια σου να δω
μ' αστέρια κεντημένα
και τα νησιά σου τα λευκά
στα κύματα λουσμένα
Θά 'ρθω για λίγο το θυμάρι να μυρίσω
και στην Ακρόπολη ξανά να περπατήσω
Κοντά σου Ελλάδα μου θα 'ρθώ, να ξαναζήσω";1;1965
Η ζωή είναι ωραία;Σκέψου;Σαρρής Γιώργος;Σαρρής Γιώργος;Σαρρής Γιώργος;PROTASIS MUSIC;2010-05-10;"Απόψε που κολλάς στο τζάμι το πρόσωπό σου
Και ψάχνεις τι έχει μείνει πιά τι είναι δικό σου
Και τρέχεις σαν σκυλί πιστό και φτύνεις αίμα
Για μια σταλιά φθηνή ζωή για ένα ψέμα

Κυλάει ο καιρός αργά στο δε βαριέσαι
Και κρύβεσαι μέσα στα μπαρ για να ξεχνιέσαι
Και ψάχνεις στα χαμένα όνειρο να νιώσεις
Στη ζάλη απ τον εαυτό σου να γλυτώσεις

Σκέψου
Ποιος κλέβει λίγο λίγο τη ζωή σου σκέψου
Αν κάποιος άλλος ζει μες το κορμί σου σκέψου
Κοιτάζεις μουδιασμένος και δε λες μια λέξη
Τι έχει φταίξει
Εδώ ειν' όλα ακόμα εδώ
Πονάει το όνειρο εδώ
Κι όλα αυτά που δεν έρχονται
Εδώ ειν' όλα ακόμα εδώ
Μην κάνεις πίσω εδώ
Μέχρι το τέλος εδώ
Σκέψου

Φυσάει ο βοριάς τρελά και βρέχει αστέρια
Τι έχεις πάθει και κατέβασες τα χέρια
Για πες μου αν χτυπάει ακόμα η καρδιά σου
Ελλάδα που σκοτώνεις έτσι τα παιδιά σου

Απόψε που ο καιρός κρυφά παραμονεύει
Η αυλή κι η γειτονιά η παλιά σου ζωντανεύει
Και τρέχουνε ανάγκες και ευθύνες χίλιες
Στην τρέλα σου ψάξε να βρεις τις Θερμοπύλες

Σκέψου
Ποιος κλέβει λίγο λίγο τη ζωή σου σκέψου
Αν κάποιος άλλος ζει μες το κορμί σου σκέψου
Κοιτάζεις μουδιασμένος και δε λες μια λέξη
Τι έχει φταίξει
Εδώ ειν' όλα ακόμα εδώ
Πονάει το όνειρο εδώ
Κι όλα αυτά που δεν έρχονται
Εδώ ειν' όλα ακόμα εδώ
Μην κάνεις πίσω εδώ
Μέχρι το τέλος εδώ
Σκέψου";1;2010
Η ζωή είναι ωραία;Ομορφη πόλη άσχημα καίγεται;Σαρρής Γιώργος;Σαρρής Γιώργος;Σαρρής Γιώργος;PROTASIS MUSIC;2010-05-10;"Ραγίζουνε οι δρόμοι απόψε από θυμό
φωνές τρελά πουλιά γυρεύουν ουρανό
Ματάδες με πολιτικά στις άκρες κόβουν την κίνηση

Κολλάει η ανάσα στο βραχνό μου το λαιμό
βρωμάει το πρόσωπό μου μαλόξ & νερό
κοιτάει μ' απορία το βράδυ & ψάχνει εξήγηση

Σταδίου χαμηλά ακούω τρελά ουρλιαχτά
ληγμένα δακρυγόνα στα Εξάρχεια
το χέρι μου γερά μη χαθούμε είναι ζόρι σου λέω

Το νου σου στα στενά γίνεται ντου ξαφνικό
ρίχνουνε κρότου λάμψης για εκφοβισμό
το στόμα μου στεγνό αγωνία & καπνό αναπνέω

Όμορφη πόλη που άσχημα καίγεσαι ξανά
φεύγει η ζωή & πάει χαράμι
μα αυτό το κάτι που εδώ μέσα με πονά
με αίμα το έγραψες στο τζάμι

Όμορφη πόλη που άσχημα καίγεσαι & κλαις
οι οθόνες ψέματα σου τάζουν
είναι ο παράδεισος μακριά ότι κι αν λες
γι' αυτούς που από μακριά κοιτάζουν

Σφυρίζουνε οι πέτρες η βιτρίνα κομμάτια
τρεχάλα πάνω κάτω μην τρίβεις τα μάτια
σκουπίδια που καπνίζουνε παντού γκρεμισμένα παρτέρια

Γερά την αλυσίδα κρατήστε μη σπάσει
αιμόφυρτη Ελλάδα το παιχνίδι έχεις χάσει
η νύχτα ένας κρότος χειροπέδες φοράει στ' αστέρια

Καμμένα λεωφορεία πανικός κι ασφυξία
μια νύχτα του 70' ζωντανεύει η Ιστορια
η Αθήνα μια τρελή που τρέχει πίσω στο χρόνο

Τελειώσανε τα λόγια & τα ψέματα
κάποιος ριγμένος μεσ' την άσφαλτο στα αίματα

Τι τον χτυπάτε ρε; Ένα πεσμένο παιδί είναι μόνο!";1;2010
Αργοναύτες;Ελένη;Ανδριόπουλος Ηλίας;Σεφέρης Γιώργος;Μητσιάς Μανώλης;LYRA ( EL );1998-03-01;"Έζησα τη ζωή μου ακούγοντας 
ονόματα πρωτάκουστα .
Καινούργιους τόπους , 
καινούργιες τρέλες των ανθρώπων
ή των θεών .

Η μοίρα μου που κυματίζει 
ανάμεσα στο στερνό σπαθί ενός Αίαντα
και μιαν άλλη Σαλαμίνα , 
μ' έφερε εδώ σ' αυτό το γυρογιάλι .


Μεγάλος πόνος είχε πέσει στην Ελλάδα . 
Τόσα κορμιά ριγμένα στα σαγόνια της θάλασσας , 
στα σαγόνια της γης . Τόσες ψυχές 
δοσμένες στις μυλόπετρες , σαν το σιτάρι . 
Κι οι ποταμοί φουσκώναν μες στη λάσπη το αίμα 
για ένα λινό κυμάτισμα , για μια νεφέλη , 
μιας πεταλούδας τίναγμα , το πούπουλο ενός κύκνου , 
για ένα πουκάμισο αδειανό , για μιαν Ελένη .";1;1998
Αρκαδία V;Γιγάντιες σκέψεις;Θεοδωράκης Μίκης;Σικελιανός Αγγελος;Καλογιάννης Αντώνης;POLYDOR ( DE );1970-01-01;"Γιγάντιες σκέψεις, σα νέφη πύρινα η νησιά πορφυρωμένα
σε μυθικὸν ηλιοβασίλεμα, άναβαν στο νου μου,
τι όλη μου καίονταν μονομιάς η ζωή στην έγνοια
της καινούργιας λευτεριάς Σου, Ελλάδα. γι᾿ αυτό δεν είπα∙

Τούτο είναι το φως της νεκρικής πυράς μου...

Δαυλός της Ιστορίας Σου, έκραξα είμαι, και να,
ας καεί σαν δάδα το έρμο μου κουφάρι, με την δάδα τούτην,
ορθός πορεύοντας, ως με την ύστερη ώρα,
όλες να φέξουν τέλος οι γωνιές της οικουμένης,
ν᾿ ανοίξω δρόμο στην ψυχή, στὸ πνεύμα, στὸ κορμί Σου, Ελλάδα.

Είπα, και εβάδισα
κρατώντας τ᾿ αναμμένο μου συκώτι στον Καύκασό Σου,
και το κάθε πάτημά μου ήταν το πρώτο,
κι ήταν, θάρρευα, το τελευταίο,
τι το γυμνό μου πόδι επάτει μέσα στὰ αίματά Σου,
τι το γυμνό μου πόδι εσκόνταυε στα πτώματά Σου,
γιατί το σώμα, η όψη μου, όλο μου το πνεύμα καθρεφτιζόταν,
σα σε λίμνη, μέσα στα αἱματά Σου.

Εκεί, σε τέτοιον άλικο καθρέφτη. Ελλάδα, καθρέφτη απύθμενο,
καθρέφτη της αβύσσου, της Λευτεριάς Σου και της δίψας Σου,
είδα τον εαυτό μου βαρύ από κοκκινόχωμα πηλό πλασμένο,
καινούργιο Αδάμ της πιο καινούργιας Πλάσης
όπου να πλάσουνε για 'σένα μέλλει. Ελλάδα.";1;1970
Αρκαδία V;Ετσι σαν έριξα και το στερνό δαυλί;Θεοδωράκης Μίκης;Σικελιανός Αγγελος;Θεοδωράκης Μίκης;;1970-01-01;"Έτσι, σαν έριξα και το στερνό δαυλί στὸ φωτογώνι
δαυλί της ζωής μου της κλεισμένης μέσ᾿ στο χρόνο
στὸ φωτογώνι της καινούργιας λευτεριᾶς σου, Ελλάδα
αναψυχώθηκε άξαφνα τρανή η κραυγή μου, ως να 'ταν
όλο χαλκός το διάστημα ή ως να 'χα τ᾿ άγιο κελί
του Ηράκλειτου τριγύρα μου, όπου, χρόνια,
για την αιωνιότητα εχάλκευε τους στοχασμούς του
και τους κρεμνούσε ως άρματα στης Έφεσος το ναό
ως σας έκραζα σύντροφοι.";1;1970
Resistance;Κι είπα;Θεοδωράκης Μίκης;Σικελιανός Αγγελος;Θεοδωράκης Μίκης;EROS MUSIC;2005-01-01;"Κι είπα∙
Το ξέρω, ναι που κι οι Θεοί σου,
οι Ολύμπιοι χθόνιο τώρα γίνανε θεμέλιο,
γιατί τους θάψαμε βαθιά βαθιά, να μην τους βρουν οι ξένοι.
Και το θεμέλιο διπλό στέριωσε κι᾿ ετριπλοστέριωσε
όλο μ᾿ όσα οι οχτροί μας κόκαλα σωριάσανε από πάνω...
κι᾿ ακόμα ξέρω πως για τις σπονδές και το τάμα
του νέου Ναού π᾿ ονειρευτήκαμε γιὰ σένα, Ελλάδα,
μέρες και νύχτες τόσα αδέλφια σφάχτηκαν ανάμεσά τους,
όσα δὲ σφάχτηκαν αρνιά ποτέ για Πάσχα...
";1;2005
Resistance;Ομπρός βοηθάτε;Θεοδωράκης Μίκης;Σικελιανός Αγγελος;Θεοδωράκης Μίκης;EROS MUSIC;2005-01-01;"Ομπρός βοηθάτε να σηκώσουμε τον Ηλιο πάνω από την Ελλάδα,
ομπρός, βοηθάτε να σηκώσουμε τον Ηλιο πάνω από τον κόσμο
Τι. ιδέτε εκόλλησεν η ρόδα του βαθιά στη λάσπη,
κι α, ιδέτε χώθηκε τ᾿ αξόνι του βαθιά μέσ᾿στο αίμα.
Ομπρός, παιδιά, και δε βολεί μονάχος ν᾿ ανέβει ο ήλιος,
σπρώχτε με γόνα και με στήθος να τον βγάλουμε απ᾿ τη λάσπη,
σπρώχτε με στήθος και με γόνα να τον βγάλουμε απ᾿ το γαίμα.
Δέστε, ακουμπάμε απάνω του ομοαίματοι αδελφοί του.
Ομπρός, αδέλφια, και μας έζωσε με τη φωτιά του,
ομπρός, ομπρός κι η φλόγα του μας τύλιξε αδελφοί μου.
";1;2005
Αρκαδία V;Σαν έριξα και το στερνό δαυλί;Θεοδωράκης Μίκης;Σικελιανός Αγγελος;Φαραντούρη Μαρία;POLYDOR ( DE );1970-01-01;"Σαν έριξα και το στερνό δαυλί στὸ φωτογώνι,
(δαυλί της ζωής μου της κλεισμένης μέσ᾿ στο χρόνο)
στο φωτογώνι της καινούργιας λευτεριάς σου, Ελλάδα,
μου αναλαμπάδιασε άξαφνα η ψυχή σαν να 'ταν
όλο χαλκός το διάστημα, ή ως να 'χα, τ᾿ άγιο κελί
του Ηράκλειτου τριγύρα μου, όπου, χρόνια,
για τὴν Αἰωνιότη εχαλκευε τοὺς λογισμούς του
και τους κρεμνουσε ως άρματα στης Έφεσος το Ναό...";1;1970
Τα τραγούδια της φαμίλιας;Το τρελάδικο η Αθήνα;Σίμος Βαγγέλης;Σίμος Βαγγέλης;Αντωνίου Κατερίνα;VENUS ( EL );1984-01-01;"Είχα μια βάρκα σε νησί
κι ένα μικρό περβόλι
τα πούλησα μισοτιμή
κι ήρα εδώ στην πόλη.

Και που να το φανταστώ
πως τρελλάδικο σωστό
είναι μέσα στην Αθήνα,
στο νησί περνούσα φίνα.

Πούλησα αμπέλι σε βουνό
κι ένα μικρό σπιτάκι
σ' ένα δυάρι να κλειστώ
μες στο Μοναστηράκι.

Και που να το φανταστώ
πως τρελλάδικο σωστό
είναι μέσα στην Αθήνα,
στο νησί περνούσα φίνα.";1;1984
Γειά σου και 'σένα;Μετά το πτυχίο;Σκαμάγκας Ακης;Σκαμάγκας Ακης;Γιοκαρίνης Γιάννης;LYRA ( EL );1988-01-01;"Τώρα που έμαθες το σολ
το λα το σι και τα λοιπά,
σολφέζ και θεωρία
κι αν θες να γίνεις μουσικός
να 'σαι της νύχτας βασιλιάς
να μπεις στην ιστορία.
Κοίτα να μάθεις το ρυθμό
που κτίζει τον πολιτισμό
και την πρωτοπορία.

Λέλι λέλι γιαλελέλι
όταν παίζεις τσιφτετέλι
θα 'χεις πάντα στο καρβέλι
φέσκο βούτυρο και μέλι.
Λέλι λέλι Λέλι λέλι γιαλελέλι
χτύπα το και μη σε μέλλει
στην Ελλάδα ζεις εν τέλει
γιαλελέλι, γιαλελέλι ω!

Τώρα που έμαθες το φα
πεντάγραμμο και τα λοιπά
άρπες και πρίμα βίστα
κι αν θες να κάνεις και σουξέ
και πρώτος να 'σαι στην κορφή
των τραγουδιών τη λίστα
κοίτα να μάθεις το ρυθμό
που σβήνει φτώχια και καημό
ο Έλληνας στην πίστα.

Λέλι λέλι γιαλελέλι
όταν παίζεις τσιφτετέλι
θα 'χεις πάντα στο καρβέλι
φέσκο βούτυρο και μέλι.
Λέλι λέλι γιαλελέλι
βάρα το και μη σε μέλλει
στην Ελλάδα ζεις εν τέλει
γιαλελέλι, γιαλελέλι ω!

Τώρα που τ' άκουσες αυτά
πάρ' το πτυχίο στα κλεφτά
και βάλτο εκεί που ξέρεις
και φτύσε με κανονικά
γιατί χρονάκια αρκετά
σε είχα να υποφέρεις
και πέσε με φανατισμό
να μάθεις το χρυσό ρυθμό
για να τα καταφέρεις.

έλι λέλι γιαλελέλι
όταν παίζεις τσιφτετέλι
θα 'χεις πάντα στο καρβέλι
φέσκο βούτυρο και μέλι.
Λέλι λέλι γιαλελέλι
βάρα το και μη σε μέλλει
στην Ελλάδα ζούμε εν τέλει
γιαλελέλι, γιαλελέλι ω!";1;1988
Τι κούραση να ξεκουράζεσαι;Τι κούραση να ξεκουράζεσαι;Σκορδίλης Αγγελος;Σκορδίλης Αγγελος;Σκορδίλης Αγγελος;LYRA ( EL );1986-09-01;"Πέφτω να κοιμηθώ
Και κάνω το σταυρό μου
Μήπως και χάϊ κατάσταση
Συμβεί στο όνειρο μου
Και 'κει λέει που βρισκόμουνα
Κάπου προς τις Μπαχάμες
Ξυπνάω στο κρεβάτι μου
Και ήμουνα με πυτζάμες
Τι κακό...

Ξαπλώνω πάλι να μπλεχτώ
Στα δίχτυα του ονείρου
Και κολλητά θε' να χαθώ
Στην όαση του απείρου
Μα σαν σε βίντεο σε ριπλέϊ
Πεσμένη και στο ντούκου
Βλέπω την πρωϊνή δουλειά
Και να μου κάνει κούκου

Τι κούραση λοιπόν
Που είναι να ξεκουράζεσαι
Αφού και στο βαθύ σου ύπνο
Βλέπεις ότι εργάζεσαι
Κι έτσι εντός δικαίου
Σαλτάρεις και ταράζεσαι
Κι όλο μονολογείς
Τι κούραση να ξεκουράζεσαι

Ξύπνησε όμως τώρα πια
Κι ο παλιός εαυτός μου
Και 'κει που 'πινα το τσάϊ μου
Ακόμα και το αλλιώς μου
Και με δυό δράμια απο το καλό
Τραβάω για τις Μπαχάμες
Θα πεις πάλι φανταστικά
Αλλά χωρίς πυτζάμες

Εμπρός λοιπόν όλοι μαζί
Για μια Ελλάδα νέα
Να μη χρειάζεται δουλειά
Να τη περνάς ωραία
Να φτιάχνουμε ξενώνες λουξ
Σ' όσους γουστάρουν ξάπλα
Να παίρνουν και τα φράγκα τους
Και μέρα νύχτα τάβλα

Τι κούραση λοιπόν
Που είναι να ξεκουράζεσαι
Αφού και στο βαθύ σου ύπνο
Βλέπεις ότι εργάζεσαι
Κι έτσι εντός δικαίου
Σαλτάρεις και ταράζεσαι
Κι όλο μονολογείς
Τι κούραση να ξεκουράζεσαι

Τι κούραση να ξεκουράζεσαι...";1;1986
